{
  "$schema": "https://json-schema.org/draft/2020-12/schema",
  "title": "weft patch",
  "description": "A weft patch file (`patches/<name>.json`): one recorded unit of template\nbehavior. The file name (stem) is the patch's name; its content id is\ncomputed on load and never stored.",
  "type": "object",
  "properties": {
    "title": {
      "description": "Display title, e.g. \"Add Prisma support\" — metadata, never hashed.",
      "type": [
        "string",
        "null"
      ],
      "default": null
    },
    "description": {
      "description": "What this patch does — metadata, never part of the content hash.",
      "type": [
        "string",
        "null"
      ],
      "default": null
    },
    "tags": {
      "description": "Free-form labels — metadata, never part of the content hash.",
      "type": "array",
      "items": {
        "type": "string"
      },
      "default": []
    },
    "depends_on": {
      "description": "Names of the graph nodes this patch depends on: another patch's file\nstem (own or inherited through `[template] extends`), or a single\ninclude's patch as `<include>/<patch>` (nested: `<include>/<include>/\n<patch>`). Depending on an include's node is what allows this patch\nto edit files under that include's mount. A repeat include has no\nnameable nodes — use `foreach`. Patches with no dependency path\nbetween them must commute.",
      "type": "array",
      "items": {
        "type": "string"
      },
      "default": []
    },
    "when": {
      "description": "Starlark gate: apply this patch (and its dependents) only if truthy.",
      "type": [
        "string",
        "null"
      ],
      "default": null
    },
    "foreach": {
      "description": "Integration patch: render once per instance of the named include.\n`key` and `instance_<child-question>` are in scope for segments and\nexpressions. Behavioral — part of the content hash. Foreach patches\nmust be graph leaves.",
      "type": [
        "string",
        "null"
      ],
      "default": null
    },
    "ops": {
      "description": "Operations, applied in order. May be omitted for **action patches**\nthat exist only to carry hooks (e.g. a gated deploy).",
      "type": "array",
      "items": {
        "$ref": "#/$defs/Op"
      }
    },
    "hooks": {
      "description": "Pre/post-render side-effects owned by this patch. Metadata: never part\nof the content hash, so adding/editing a hook never changes patch ids.",
      "type": "array",
      "items": {
        "$ref": "#/$defs/Hook"
      }
    },
    "generator": {
      "description": "Present when this patch was recorded from a command's output\n(`weft record --exec`). Metadata: never part of the content hash.",
      "anyOf": [
        {
          "$ref": "#/$defs/Generator"
        },
        {
          "type": "null"
        }
      ]
    }
  },
  "additionalProperties": false,
  "$defs": {
    "Op": {
      "description": "A single tree operation, applied in order.",
      "oneOf": [
        {
          "description": "Create a file (errors if it already exists).",
          "type": "object",
          "properties": {
            "path": {
              "$ref": "#/$defs/TemplatePath"
            },
            "omit_when_empty": {
              "description": "Slots of `content` that, when every one of them is still empty at\nthe end of the render, leave the file out altogether.",
              "type": "array",
              "items": {
                "type": "string"
              },
              "default": []
            },
            "content": {
              "description": "File content as an array of lines; a `{\"slot\": …}` line declares\na slot.",
              "type": "array",
              "items": {
                "$ref": "#/$defs/AddedLine"
              }
            },
            "mode": {
              "description": "Unix mode as decimal (420 = 0o644, 493 = 0o755). Default 420.",
              "type": [
                "integer",
                "null"
              ],
              "format": "uint32",
              "minimum": 0,
              "default": null
            },
            "op": {
              "type": "string",
              "const": "create_file"
            }
          },
          "additionalProperties": false,
          "required": [
            "op",
            "path",
            "content"
          ]
        },
        {
          "description": "Create an opaque binary file (errors if it already exists). The\ncontent is never abstracted or hunk-modified — replacing a binary is\n`delete_file` + a new `create_binary_file` in the same patch.",
          "type": "object",
          "properties": {
            "path": {
              "$ref": "#/$defs/TemplatePath"
            },
            "data": {
              "description": "Raw bytes, standard-alphabet base64.",
              "type": "string"
            },
            "mode": {
              "description": "Unix mode as decimal (420 = 0o644, 493 = 0o755). Default 420.",
              "type": [
                "integer",
                "null"
              ],
              "format": "uint32",
              "minimum": 0,
              "default": null
            },
            "op": {
              "type": "string",
              "const": "create_binary_file"
            }
          },
          "additionalProperties": false,
          "required": [
            "op",
            "path",
            "data"
          ]
        },
        {
          "description": "Modify an existing file with context-anchored hunks.",
          "type": "object",
          "properties": {
            "path": {
              "$ref": "#/$defs/TemplatePath"
            },
            "hunks": {
              "type": "array",
              "items": {
                "$ref": "#/$defs/Hunk"
              }
            },
            "op": {
              "type": "string",
              "const": "modify_file"
            }
          },
          "additionalProperties": false,
          "required": [
            "op",
            "path",
            "hunks"
          ]
        },
        {
          "description": "Delete an existing file.",
          "type": "object",
          "properties": {
            "path": {
              "$ref": "#/$defs/TemplatePath"
            },
            "op": {
              "type": "string",
              "const": "delete_file"
            }
          },
          "additionalProperties": false,
          "required": [
            "op",
            "path"
          ]
        },
        {
          "description": "Rename/move a file (target must not exist).",
          "type": "object",
          "properties": {
            "from": {
              "$ref": "#/$defs/TemplatePath"
            },
            "to": {
              "$ref": "#/$defs/TemplatePath"
            },
            "op": {
              "type": "string",
              "const": "rename_path"
            }
          },
          "additionalProperties": false,
          "required": [
            "op",
            "from",
            "to"
          ]
        },
        {
          "description": "Change a file's mode.",
          "type": "object",
          "properties": {
            "path": {
              "$ref": "#/$defs/TemplatePath"
            },
            "mode": {
              "description": "Unix mode as decimal (493 = 0o755).",
              "type": "integer",
              "format": "uint32",
              "minimum": 0
            },
            "op": {
              "type": "string",
              "const": "set_mode"
            }
          },
          "additionalProperties": false,
          "required": [
            "op",
            "path",
            "mode"
          ]
        },
        {
          "description": "Add lines to a slot of an existing file as the contribution under\n`key`. Contributions render sorted by key, so patches that only fill\nslots commute; two with one key in one slot are an error.",
          "type": "object",
          "properties": {
            "path": {
              "$ref": "#/$defs/TemplatePath"
            },
            "slot": {
              "description": "The slot's name, as its file declares it.",
              "type": "string"
            },
            "key": {
              "description": "Orders the contribution within the slot: a plain string when\nliteral, or an array of segments (a foreach patch needs the\ninstance `key` in it). Recording uses the patch's name.",
              "$ref": "#/$defs/Line"
            },
            "lines": {
              "description": "The contribution's lines (at least one; slots do not nest).",
              "type": "array",
              "items": {
                "$ref": "#/$defs/Line"
              },
              "minItems": 1
            },
            "op": {
              "type": "string",
              "const": "fill_slot"
            }
          },
          "additionalProperties": false,
          "required": [
            "op",
            "path",
            "slot",
            "key",
            "lines"
          ]
        }
      ]
    },
    "TemplatePath": {
      "description": "A path inside the rendered tree: a plain string when fully literal, or an\narray of segments. Relative, `/`-separated, no `..`.",
      "anyOf": [
        {
          "type": "string"
        },
        {
          "type": "array",
          "items": {
            "$ref": "#/$defs/Segment"
          }
        }
      ]
    },
    "Segment": {
      "description": "One piece of a path or content line.",
      "anyOf": [
        {
          "description": "Literal text.",
          "type": "string"
        },
        {
          "description": "Substitute an answer's value at render time.",
          "type": "object",
          "properties": {
            "answer": {
              "description": "The question id whose value is substituted.",
              "type": "string"
            }
          },
          "additionalProperties": false,
          "required": [
            "answer"
          ]
        },
        {
          "description": "Evaluate a Starlark expression at render time.",
          "type": "object",
          "properties": {
            "expr": {
              "description": "Starlark source; answers are in scope as variables.",
              "type": "string"
            }
          },
          "additionalProperties": false,
          "required": [
            "expr"
          ]
        }
      ]
    },
    "AddedLine": {
      "description": "One line of the lines a patch adds (`create_file` content, a hunk's\n`added`): a line, or a slot declaration.",
      "anyOf": [
        {
          "type": "string"
        },
        {
          "type": "array",
          "items": {
            "$ref": "#/$defs/Segment"
          }
        },
        {
          "description": "Declare a slot here: a named place other patches add lines to with\n`fill_slot`. It renders their contributions sorted by key.",
          "$ref": "#/$defs/SlotDecl"
        }
      ]
    },
    "SlotDecl": {
      "description": "A slot declaration, a line of its own.",
      "type": "object",
      "properties": {
        "slot": {
          "description": "The slot's name, unique within the file: ASCII letters, digits, `-`,\n`_` and `.`.",
          "type": "string",
          "pattern": "^[A-Za-z0-9_.-]+$"
        },
        "separator": {
          "description": "Appended to the last line of every contribution but the final one\n(e.g. `,` between JSON entries).",
          "type": [
            "string",
            "null"
          ],
          "default": null
        }
      },
      "additionalProperties": false,
      "required": [
        "slot"
      ]
    },
    "Hunk": {
      "description": "A context-anchored change: `context_before + removed + context_after`\nmust match exactly once in the rendered file; `removed` is replaced with\n`added`. An entirely empty pattern appends at end of file.",
      "type": "object",
      "properties": {
        "context_before": {
          "type": "array",
          "items": {
            "$ref": "#/$defs/Line"
          }
        },
        "removed": {
          "type": "array",
          "items": {
            "$ref": "#/$defs/Line"
          }
        },
        "added": {
          "type": "array",
          "items": {
            "$ref": "#/$defs/AddedLine"
          }
        },
        "context_after": {
          "type": "array",
          "items": {
            "$ref": "#/$defs/Line"
          }
        }
      },
      "additionalProperties": false
    },
    "Line": {
      "description": "One line of file content: a plain string when fully literal, or an array\nof segments.",
      "anyOf": [
        {
          "type": "string"
        },
        {
          "type": "array",
          "items": {
            "$ref": "#/$defs/Segment"
          }
        }
      ]
    },
    "Hook": {
      "description": "A patch-scoped side-effect that runs before (`pre`) or after (`post`) the\nrender.",
      "type": "object",
      "properties": {
        "id": {
          "description": "Unique slug across the template (referenced by `after`/`inputs`).",
          "type": "string"
        },
        "phase": {
          "description": "`pre` runs before any file is written (a non-zero exit aborts);\n`post` runs after the tree is written.",
          "$ref": "#/$defs/HookPhase"
        },
        "effect": {
          "description": "`check` = read-only verification (safe to auto-run); `setup` =\nidempotent local mutation; `deploy` = external/irreversible side-effect.",
          "$ref": "#/$defs/HookEffect"
        },
        "label": {
          "description": "Short human/agent label, e.g. \"Verify uv is installed\".",
          "type": "string"
        },
        "description": {
          "type": [
            "string",
            "null"
          ],
          "default": null
        },
        "action": {
          "description": "Shell command: a plain string when literal, or an array of segments to\ninterpolate answers/exprs (e.g. `[\"shadcn add \", {\"expr\": \"...\"}]`).",
          "$ref": "#/$defs/Command"
        },
        "when": {
          "description": "Starlark gate.",
          "type": [
            "string",
            "null"
          ],
          "default": null
        },
        "after": {
          "description": "Other hooks this one must run after (ordering edges).",
          "type": "array",
          "items": {
            "type": "string"
          },
          "default": []
        },
        "inputs": {
          "description": "Post-only: `glob:PATTERN`, `answer:ID`, or `hook:ID` — on `weft update`\nthis hook re-fires only when one changed.",
          "type": "array",
          "items": {
            "type": "string"
          },
          "default": []
        }
      },
      "additionalProperties": false,
      "required": [
        "id",
        "phase",
        "effect",
        "label",
        "action"
      ]
    },
    "HookPhase": {
      "type": "string",
      "enum": [
        "pre",
        "post"
      ]
    },
    "HookEffect": {
      "type": "string",
      "enum": [
        "check",
        "setup",
        "deploy"
      ]
    },
    "Command": {
      "description": "A shell command: a plain string, or an array of segments.",
      "anyOf": [
        {
          "type": "string"
        },
        {
          "type": "array",
          "items": {
            "$ref": "#/$defs/Segment"
          }
        }
      ]
    },
    "Generator": {
      "description": "The command a generated patch was recorded from, plus what\n`weft patch resync` needs to re-run it deterministically.",
      "type": "object",
      "properties": {
        "command": {
          "description": "Shell command run in the recording worktree: a plain string when\nliteral, or an array of segments to interpolate answers/exprs.",
          "$ref": "#/$defs/Command"
        },
        "answers": {
          "description": "Record-time answers the base was rendered with (secrets excluded).",
          "type": "object",
          "additionalProperties": true,
          "default": {}
        },
        "secrets": {
          "description": "Secret answers as source references (`env:…`, `cmd:…`, `prompt`),\nre-resolved at resync time — values never appear here.",
          "type": "object",
          "additionalProperties": {
            "type": "string"
          },
          "default": {}
        },
        "keep_literal": {
          "description": "Occurrences kept literal at commit (`ANSWER@PATH:LINE[:NTH]`),\nreplayed on resync.",
          "type": "array",
          "items": {
            "type": "string"
          },
          "default": []
        }
      },
      "additionalProperties": false,
      "required": [
        "command"
      ]
    }
  }
}
